case_id,dataset_source,subset_tags,why_selected
stage2_calibration_clear_win_v9,BURST,"calibration-only,state-identifiability-success,occlusion_reappearance,long_gap_persistence,crossing_ambiguity,small_object,appearance_change",Calibration-only clear win on protocol v3.
stage2_calibration_fail_v9,BURST,"calibration-only-fail,state-identifiability-failure,occlusion_reappearance,long_gap_persistence,crossing_ambiguity,small_object",Calibration-only failure case retained for balance.
stage2_legacysem_win_v9,BURST,"legacysem-win,occlusion_reappearance,long_gap_persistence,crossing_ambiguity,small_object",Legacysem wins on this item.
stage2_cropenc_win_v9,BURST,"cropenc-win,occlusion_reappearance,long_gap_persistence,crossing_ambiguity,small_object,appearance_change",Cropenc wins on this item.
stage2_noalign_failure_v9,BURST,"noalign-failure,occlusion_reappearance,long_gap_persistence,crossing_ambiguity,small_object,appearance_change",Noalign ablation failure representative.
stage2_densegate_failure_v9,BURST,"densegate-failure,crossing_ambiguity,small_object,appearance_change",Densegate ablation failure representative.
